company_name,company_email,title,description,employment_type,experience_level,category,city,state,country,location_type,department,timezone,responsibilities,requirements,nice_to_have,skills,benefits,salary_min,salary_max,salary_currency,salary_period,show_salary,equity,equity_min,equity_max,apply_method,apply_email,apply_url,apply_instructions,meta_title,meta_description
"Maple Leaf Technologies",hr@mapleleaftech.ca,"Senior Software Engineer","We are looking for a senior software engineer to lead development of our core platform. You will architect scalable microservices, mentor junior developers, and drive technical decisions across the engineering team.",full_time,senior,engineering,Toronto,Ontario,Canada,hybrid,Engineering,America/Toronto,"Architect and build scalable microservices;Mentor junior and mid-level engineers;Lead code reviews and set engineering standards;Collaborate with product on technical roadmap","5+ years software development experience;Proficient in Python and TypeScript;Experience designing distributed systems;Strong understanding of relational and NoSQL databases","Experience with Django or FastAPI;Knowledge of AWS or GCP;Contributions to open-source projects","Python;TypeScript;PostgreSQL;Redis;Docker;AWS","Comprehensive health and dental insurance;Hybrid work flexibility;$2,000 annual learning budget;Stock options",130000,170000,CAD,year,true,true,0.05,0.15,internal,,,"Senior Software Engineer - Toronto (Hybrid)","Join our engineering team as a Senior Software Engineer. Competitive salary $130K-$170K CAD with equity. Hybrid work in Toronto."
"Maple Leaf Technologies",hr@mapleleaftech.ca,"Marketing Coordinator","Join our marketing team to coordinate campaigns across digital and traditional channels. You will manage social media calendars, assist with content creation, and track campaign performance metrics.",full_time,entry,marketing,Vancouver,British Columbia,Canada,onsite,Marketing,America/Vancouver,"Manage social media content calendar;Coordinate email marketing campaigns;Track and report on campaign KPIs;Assist with event planning and logistics","Bachelor's degree in Marketing or related field;1+ years of marketing experience or internship;Familiarity with social media platforms and analytics;Strong written and verbal communication skills","Experience with HubSpot or Mailchimp;Basic graphic design skills (Canva, Figma);Google Analytics certification","Social Media;Email Marketing;Content Writing;Google Analytics;Canva","Extended health benefits;Transit pass;3 weeks paid vacation",45000,55000,CAD,year,true,false,,,email,careers@example.com,,"Please include a cover letter and portfolio link.",,
"Northern Digital Inc.",careers@northerndigital.com,"UX/UI Designer","We need a creative UX/UI designer to craft intuitive user experiences for our SaaS platform. You will conduct user research, create wireframes and prototypes, and collaborate closely with engineering to ship polished features.",contract,mid,design,Montreal,Quebec,Canada,remote,Design,America/Montreal,"Conduct user research and usability testing;Create wireframes, mockups, and interactive prototypes;Maintain and evolve the design system;Work with engineers to ensure pixel-perfect implementation","3+ years of UX/UI design experience;Proficiency with Figma;Portfolio demonstrating end-to-end design process;Understanding of accessibility standards (WCAG)","Experience with SaaS products;Motion design skills (After Effects, Lottie);Basic front-end knowledge (HTML/CSS)","Figma;User Research;Prototyping;Design Systems;Accessibility","Fully remote position;Flexible working hours;Equipment allowance",75,95,CAD,hour,true,false,,,external,,https://careers.example.com/apply/ux-designer,,"UX/UI Designer (Remote Contract)","Remote contract UX/UI designer role. $75-$95/hr CAD. Join our design team to shape the future of our SaaS platform."
"Pacific Coast Solutions",jobs@pacificcoast.io,"Data Analyst","Seeking a data analyst to turn raw data into actionable business insights. You will build dashboards, write SQL queries, and present findings to stakeholders across the organization.",full_time,mid,data,Calgary,Alberta,Canada,hybrid,Data & Analytics,America/Edmonton,"Build and maintain business intelligence dashboards;Write complex SQL queries for ad-hoc analysis;Present data-driven recommendations to leadership;Collaborate with engineering on data pipeline improvements","2+ years of data analysis experience;Advanced SQL skills;Experience with BI tools (Tableau, Looker, or Power BI);Strong statistical reasoning","Python or R for statistical analysis;Experience with dbt or Airflow;Knowledge of A/B testing methodology","SQL;Tableau;Python;Excel;Statistics","Health and dental coverage;RRSP matching;Flexible hybrid schedule",70000,90000,CAD,year,false,false,,,internal,,,,
"Pacific Coast Solutions",jobs@pacificcoast.io,"Customer Support Specialist","We are hiring a customer support specialist to provide world-class support to our growing user base. You will handle support tickets, troubleshoot issues, and help improve our knowledge base documentation.",part_time,entry,customer_support,Ottawa,Ontario,Canada,remote,Support,America/Toronto,"Respond to customer inquiries via chat, email, and phone;Troubleshoot and resolve product issues;Escalate complex cases to engineering;Contribute to knowledge base articles","Excellent written and verbal communication;Patience and empathy in customer interactions;Basic technical troubleshooting ability;Available for 20-25 hours per week","Experience with Zendesk or Intercom;Bilingual (English/French);Previous SaaS support experience","Customer Service;Communication;Problem Solving;Zendesk","Remote work;Flexible scheduling;Paid training",22,28,CAD,hour,true,false,,,internal,,,,
